{
  "$schema": "https://json-schema.org/draft/2020-12/schema",
  "$id": "https://mindrail.dev/schemas/knowledge/invariant.v1.schema.json",
  "title": "Mindrail Invariant record, schema version 1",
  "description": "An Invariant answers \"what must stay true after a change?\" (spec §54). Records are immutable: a newer Invariant supersedes an older one instead of overwriting it (spec §94).",
  "type": "object",
  "required": [
    "schema_version",
    "kind",
    "id",
    "status",
    "created_at",
    "statement",
    "scope",
    "severity"
  ],
  "additionalProperties": false,
  "properties": {
    "schema_version": {
      "description": "Reader compatibility window key (spec §95). 0.1 writes 1 and reads [1].",
      "type": "integer",
      "const": 1
    },
    "kind": {
      "type": "string",
      "const": "invariant"
    },
    "id": {
      "description": "Stable repository-unique identity; the file name must agree with it.",
      "type": "string",
      "pattern": "^INV-[0-9]{4,}$"
    },
    "status": {
      "description": "A superseded Invariant stays in the repository so lineage survives (spec §94).",
      "type": "string",
      "enum": ["active", "superseded"]
    },
    "created_at": {
      "description": "UTC RFC 3339 timestamp (tech-stack §42). Write it with an uppercase \"T\", a zero offset spelled \"Z\", \"+00:00\" or \"-00:00\", and at most nine fractional-second digits: the spelling Go's time.Time marshals, and the only one this project writes. The two keywords divide one rule and do not restate each other: \"format\" owns calendar validity, which a regular expression cannot decide (it knows how long February is); \"pattern\" owns the spelling, which \"format\" is deliberately permissive about. RFC 3339 is wider than §42, and on two different grounds. A lowercase \"t\" or \"z\" (RFC 3339 §5.6) and a leap second (§5.7) are refused because no reader in this project can load them at all. A non-zero offset such as \"-05:00\" is refused on the spelling rule alone: every reader loads it, and the offset names exactly the instant it says. More than nine fractional digits is refused on that same spelling rule, and loses precision whenever the extra digits are not zero. See decision D-49.",
      "type": "string",
      "format": "date-time",
      "pattern": "^[0-9]{4}-[0-9]{2}-[0-9]{2}T[0-9]{2}:[0-9]{2}:[0-5][0-9](\\.[0-9]{1,9})?(Z|[+-]00:00)$"
    },
    "statement": {
      "description": "The property that must hold, in one sentence.",
      "type": "string",
      "minLength": 1
    },
    "rationale": {
      "description": "Why violating the statement is harmful.",
      "type": "string"
    },
    "severity": {
      "description": "Drives how hard validation pushes back on a change that touches the scope (spec §51).",
      "type": "string",
      "enum": ["CRITICAL", "HIGH", "MEDIUM", "LOW"]
    },
    "supersedes": {
      "description": "Identities of the Invariants this record replaces (spec §94).",
      "type": "array",
      "items": {
        "type": "string",
        "pattern": "^INV-[0-9]{4,}$"
      },
      "uniqueItems": true
    },
    "scope": {
      "$ref": "#/$defs/scope"
    },
    "tags": {
      "type": "array",
      "items": {
        "type": "string",
        "minLength": 1
      },
      "uniqueItems": true
    }
  },
  "$defs": {
    "scope": {
      "description": "Where the record applies (spec §54 scope levels).",
      "type": "object",
      "required": ["level"],
      "additionalProperties": false,
      "properties": {
        "level": {
          "type": "string",
          "enum": ["PROJECT", "PACKAGE", "MODULE", "FILE", "SYMBOL"]
        },
        "target": {
          "description": "Repository-relative, forward-slash path or symbol reference (tech-stack §74). Absent for PROJECT scope.",
          "type": "string",
          "minLength": 1
        }
      }
    }
  }
}
